{
  "$schema": "https://json-schema.org/draft/2020-12/schema",
  "$id": "https://schemas.kumwe.org/studio/v1/migration.schema.json",
  "title": "Studio migration declaration",
  "type": "object",
  "additionalProperties": false,
  "required": [
    "contractVersion",
    "kind",
    "id",
    "version",
    "owner",
    "label",
    "artifactKinds",
    "sourceVersions",
    "targetVersion",
    "lossClassification"
  ],
  "properties": {
    "contractVersion": { "$ref": "common.schema.json#/$defs/contractVersion" },
    "kind": { "const": "migration" },
    "id": { "$ref": "common.schema.json#/$defs/qualifiedName" },
    "version": { "$ref": "common.schema.json#/$defs/semanticVersion" },
    "owner": { "$ref": "common.schema.json#/$defs/ownerReference" },
    "label": { "$ref": "common.schema.json#/$defs/messageReference" },
    "description": { "$ref": "common.schema.json#/$defs/messageReference" },
    "artifactKinds": {
      "type": "array",
      "minItems": 1,
      "maxItems": 5,
      "uniqueItems": true,
      "items": {
        "enum": ["block-definition", "blueprint", "content-model", "entry", "theme"]
      }
    },
    "sourceVersions": { "$ref": "common.schema.json#/$defs/versionRange" },
    "targetVersion": { "$ref": "common.schema.json#/$defs/semanticVersion" },
    "lossClassification": { "enum": ["lossless", "lossy"] },
    "extensions": { "$ref": "common.schema.json#/$defs/extensions" }
  }
}
