{
  "contractVersion": "0.1-draft",
  "kind": "migration",
  "id": "org.example.catalog/price-to-money",
  "version": "1.1.0",
  "owner": {
    "id": "org.example/catalog",
    "version": "1.1.0"
  },
  "label": {
    "key": "org.example.catalog/price-to-money",
    "defaultMessage": "Price becomes typed money"
  },
  "description": {
    "key": "org.example.catalog/price-to-money-description",
    "defaultMessage": "Rewrites plain price properties into the typed money value shape."
  },
  "artifactKinds": ["blueprint", "entry"],
  "sourceVersions": ">=1.0.0 <1.1.0",
  "targetVersion": "1.1.0",
  "lossClassification": "lossless"
}
